<!ELEMENT timetable ((day|timeslot|course)+)>

<!ELEMENT booking (type,room,((day, course)|(day, timeslot)|(course, timeslot)),teacher)>

<!ELEMENT type EMPTY>
<!ATTLIST type
    type (Lab|Lecture) #REQUIRED
>

<!ELEMENT teacher EMPTY>
<!ATTLIST teacher
    teacher CDATA #REQUIRED
>

<!ELEMENT room EMPTY>
<!ATTLIST room
    room CDATA #REQUIRED
>

<!ELEMENT day (booking*)>
<!ATTLIST day
    day (Monday | Tuesday | Wednesday | Thursday | Friday) #REQUIRED
>

<!ELEMENT course (booking*)>
<!ATTLIST course
    course CDATA #REQUIRED
>

<!ELEMENT timeslot (booking*)>
<!ATTLIST timeslot
    time CDATA #REQUIRED
>
